{
	"$schema": "http://json-schema.org/draft-07/schema#",
	"$id": "https://github.com/user/pi-agent-extensions/auto-rename/auto-rename.schema.json",
	"title": "Auto-Rename Configuration",
	"description": "Configuration for the pi auto-rename extension that automatically generates session names.",
	"type": "object",
	"definitions": {
		"modelConfig": {
			"type": "object",
			"description": "LLM model configuration.",
			"properties": {
				"provider": {
					"type": "string",
					"description": "LLM provider name (e.g., 'anthropic', 'openai', 'google', 'ollama').",
					"examples": ["anthropic", "openai", "google", "ollama", "groq", "mistral", "xai"]
				},
				"id": {
					"type": "string",
					"description": "Model ID within the provider.",
					"examples": ["claude-3-5-haiku-20241022", "gpt-4o-mini", "gemini-2.0-flash", "llama3.2"]
				}
			},
			"required": ["provider", "id"],
			"additionalProperties": false
		},
		"endpointConfig": {
			"type": "object",
			"description": "Direct HTTP endpoint configuration. Bypasses the Pi model registry entirely. Useful for local title-generation servers (e.g. llama.cpp) that should not be added to models.json.",
			"properties": {
				"url": {
					"type": "string",
					"description": "OpenAI-compatible chat completions endpoint URL.",
					"examples": ["http://127.0.0.1:8090/v1/chat/completions"]
				},
				"model": {
					"type": "string",
					"description": "Model identifier sent in the request body.",
					"examples": ["gemma-3-1b-title", "local-llama"]
				},
				"apiKey": {
					"type": ["string", "null"],
					"description": "Optional Bearer token for the endpoint.",
					"default": null
				},
				"timeout": {
					"type": "integer",
					"description": "Request timeout in milliseconds.",
					"default": 15000,
					"minimum": 1000,
					"maximum": 120000
				}
			},
			"required": ["url", "model"],
			"additionalProperties": false
		}
	},
	"properties": {
		"model": {
			"oneOf": [
				{ "$ref": "#/definitions/modelConfig" },
				{ "type": "null" }
			],
			"description": "Primary LLM model to use for generating session names. Set to null to use auto-selection strategy. Ignored when endpoint is set.",
			"default": null
		},
		"endpoint": {
			"oneOf": [
				{ "$ref": "#/definitions/endpointConfig" },
				{ "type": "null" }
			],
			"description": "Direct HTTP endpoint for title generation. When set, bypasses the Pi model registry and sends an OpenAI-compatible request directly. Use this for local servers (e.g. llama.cpp) that should not be added to models.json.",
			"default": null
		},
		"fallbackModel": {
			"oneOf": [
				{ "$ref": "#/definitions/modelConfig" },
				{ "type": "null" }
			],
			"description": "Fallback LLM model if primary is unavailable or fails. Set to null to skip explicit fallback.",
			"default": null
		},
		"fallbackDeterministic": {
			"type": "string",
			"enum": ["truncate", "words", "none", "readable-id"],
			"description": "Deterministic fallback method if all LLM models fail. 'truncate': first 50 chars. 'words': first 6 words. 'readable-id': adjective-noun-noun from session ID. 'none': don't set a name.",
			"default": "readable-id"
		},
		"modelSelection": {
			"type": "string",
			"enum": ["current", "cheapest"],
			"description": "Auto-selection strategy when model and fallbackModel are null. 'current': current model first, then cheapest. 'cheapest': cheapest first, then current.",
			"default": "current"
		},
		"wordlistPath": {
			"type": ["string", "null"],
			"description": "Path to a custom word_lists.toml file for readable-id generation. Relative paths are resolved from the session cwd.",
			"default": null
		},
		"wordlist": {
			"type": "object",
			"description": "Inline wordlist override for readable-id generation.",
			"properties": {
				"adjectives": { "type": "array", "items": { "type": "string" } },
				"nouns": { "type": "array", "items": { "type": "string" } }
			},
			"additionalProperties": false
		},
		"prompt": {
			"type": "string",
			"description": "Prompt template for name generation. Use {{query}} as placeholder for the user's first message.",
			"default": "Generate a short, descriptive title (max 6 words) for a chat session based on this first message:\n\n<message>\n{{query}}\n</message>\n\nRules:\n- Be concise and specific\n- Use title case\n- No quotes or punctuation at the end\n- Focus on the main topic or intent\n- If unclear, use a generic but relevant title\n\nReply with ONLY the title, nothing else."
		},
		"prefix": {
			"type": "string",
			"description": "Static prefix added before generated names. Ignored if prefixCommand is set and succeeds.",
			"default": "",
			"examples": ["[auto] ", "🔧 ", "work: "]
		},
		"prefixCommand": {
			"type": ["string", "null"],
			"description": "Shell command to generate dynamic prefix. Runs in session's cwd, stdout is trimmed. Falls back to static prefix on error. Has 5-second timeout.",
			"default": null,
			"examples": [
				"basename $(git rev-parse --show-toplevel 2>/dev/null || pwd)",
				"git branch --show-current 2>/dev/null || echo 'main'",
				"basename $(pwd)",
				"echo $PROJECT_NAME"
			]
		},
		"prefixOnly": {
			"type": "boolean",
			"description": "If true, skip LLM generation and use only the prefix (static or from command) as the full session name.",
			"default": false
		},
		"readableIdSuffix": {
			"type": "boolean",
			"description": "If true, append a deterministic readable-id (adjective-noun-noun) to the generated name.",
			"default": false
		},
		"syncTabTitle": {
			"type": "boolean",
			"description": "Project the session title to the calling Herdr tab or tmux window, without the known readable ID or sub/side marker. Shared multi-pane tabs/windows are left unchanged. Independent of automatic title generation.",
			"default": true
		},
		"syncTabTitleInbound": {
			"type": "boolean",
			"description": "Opt-in: listen for host tab renames (Herdr tab.renamed events via the session socket, tmux window-renamed hook) and apply them to the Pi session name. The canonical readable ID is always preserved. Ownership is re-verified per event; foreign/shared tabs and echo of our own pushes are ignored.",
			"default": false
		},
		"readableIdEnv": {
			"type": ["string", "null"],
			"description": "Environment variable that can provide a readable-id suffix override. When set and non-empty, its value is used instead of the wordlist-derived suffix.",
			"default": "PI_SESSION_READABLE_ID"
		},
		"maxQueryLength": {
			"type": "integer",
			"description": "Maximum number of characters from the user query to include in the LLM prompt. Longer queries have their middle cut out, preserving the beginning and end. Prevents excessive token usage on very long first messages.",
			"default": 2000,
			"minimum": 100,
			"maximum": 50000
		},
		"maxNameLength": {
			"type": "integer",
			"description": "Maximum number of characters allowed for the generated session name (before prefix/suffix). LLM responses exceeding this limit are truncated at a word boundary with an ellipsis. The rename_session tool description and prompt snippet show this limit to the model (read at extension load).",
			"default": 80,
			"minimum": 10,
			"maximum": 500
		},
		"enabled": {
			"type": "boolean",
			"description": "Enable or disable auto-rename functionality.",
			"default": true
		},
		"debug": {
			"type": "boolean",
			"description": "Enable debug notifications for troubleshooting.",
			"default": false
		}
	},
	"additionalProperties": false,
	"examples": [
		{
			"endpoint": {
				"url": "http://127.0.0.1:8090/v1/chat/completions",
				"model": "gemma-3-1b-title"
			},
			"fallbackDeterministic": "words",
			"enabled": true
		},
		{
			"model": null,
			"fallbackModel": null,
			"modelSelection": "current",
			"enabled": true
		},
		{
			"prefixCommand": "basename $(git rev-parse --show-toplevel 2>/dev/null || pwd)",
			"prefixOnly": true
		},
		{
			"model": { "provider": "openai", "id": "gpt-4o-mini" },
			"fallbackModel": null,
			"fallbackDeterministic": "words",
			"prefixCommand": "git branch --show-current",
			"prefix": "main"
		},
		{
			"model": { "provider": "ollama", "id": "llama3.2" },
			"fallbackModel": { "provider": "anthropic", "id": "claude-3-5-haiku-20241022" },
			"fallbackDeterministic": "readable-id"
		}
	]
}
